{
  "schema_version": 1,
  "event_name": "ores.client.backpressure",
  "phase": "delayed",
  "transport": "rpc",
  "reason": "server_retry_after",
  "observed_at_unix_ms": 1790784000250,
  "queued_at_unix_ms": 1790784000000,
  "queue_age_ms": 250,
  "scheduled_delay_ms": 750,
  "queue_depth": 3,
  "queue_bytes": 4096,
  "retry_after_ms": 750,
  "recommended_next_request_after_ms": 750,
  "policy_version": "free.v1",
  "quota_fence": "18446744073709551615",
  "limiting_policy_ids": ["minute", "ten-minute"],
  "attempt": 1,
  "operation": "jobs.submit",
  "idempotent": true
}
